Tema,Pergunta
Nova Ordem Mundial,"13. (UECE) “(...)Pelo caminho perdemos até o direito de nos chamarmos americanos, embora os haitianos e os cubanos já estivessem inscritos na História, como novos povos, um século antes que os peregrinos do Mayflower se estabelecessem nas costas de Plymouth. Agora, para o mundo, América é tão só os Estados Unidos, e nós quando muito habitamos uma subAmérica, uma América de segunda classe, de nebulosa identidade (...)”

					(GALEANO, Eduardo. As veias abertas da América Latina. Tradução de Sérgio Faraco. São Paulo: L&PM, 2010. p. 18). 



					A partir do excerto acima, pode-se concluir acertadamente que  

					
						os haitianos e os cubanos não são americanos.


						os peregrinos do Mayflower são historicamente americanos.


						 a identidade americana é negada para os habitantes da América Latina.


						 a cidadania americana pertence exclusivamente aos Estados Unidos."
Nova Ordem Mundial,"14. (UPE) A passagem do século XVIII para o XIX foi marcada por um desequilíbrio nas relações entre a Europa e o Novo Mundo. As lutas políticas na América estavam ligadas à resistência contra a colonização europeia e às influências das ideias liberais. Sobre essa crise do Antigo Regime e suas i mplicações na América, assinale a alternativa CORRETA.  

					
						 A Guerra de Independência dos Estados Unidos acirrou as tensões políticas pré-existentes entre a França e a Inglaterra, servindo de palco para um confronto indireto entre essas duas nações.


						As tensões políticas entre a Espanha e suas colônias na América acabaram por reestruturar o império espanhol que, mediante as reformas bourbonianas, conseguiu manter seu poderio na América, até o final do século XIX.


						 As relações entre Portugal e a América Portuguesa só se agravaram após a transmigração da família real para o Brasil em 1808, fugindo da invasão napoleônica.


						 A Guerra do Paraguai, envolvendo Brasil, Portugal, Paraguai, Espanha e Inglaterra, é fruto direto desse contexto.


						As Conjurações Baiana e Mineira, ocorridas no início do século XIX, são reflexos desse quadro de desequilíbrio político entre Portugal e sua colônia na América."
Nova Ordem Mundial,"15. (FAMECA) A nova ordem mundial, conjunto de características econômicas, políticas e sociais, consolidou-se com o fim da Guerra Fria. Sobre essa nova configuração, é correto afirmar que  

					
						 a organização de fóruns de debates internacionais passou a se constituir elemento chave para o novo cenário, resgatando o respeito pelos líderes mundiais.


						as superpotências passaram a ser definidas pela elevada produtividade baseada no domínio técnico, científico e militar, conferindo maior competitividade.


						 as lideranças se construíram de modo natural e as novas potências assumiram seu papel de orientação, criando um cenário positivo para debates democráticos.


						 a capacidade militar se manteve preponderante nas definições das áreas de influência dos países, elegendo novos líderes mundiais.


						os grandes países de influência global foram escolhidos a partir de instâncias políticas capitaneadas por órgãos internacionais, avaliando suas potencialidades."
Tigres Asiáticos,"01. (UEFS) Coreia do Sul, Taiwan, Hong Kong e Cingapura ficaram conhecidos na década de 1980 como Tigres Asiáticos. Nesse período, esses países apresentavam como característica comum

 					
 						 a concessão de incentivos às exportações de produtos primários, caracterizada como auxílio aos países pobres em recursos naturais.


 						o intenso investimento em infraestruturas, adotado por permitir o transporte de insumos energéticos aos países subdesenvolvidos da região.


 						o rápido processo de industrialização, favorecido pelos mecanismos da Guerra Fria para fazer frente ao avanço sino-soviético.


 						a criação de medidas protecionistas, estratégia adotada para reforçar seus modelos econômicos baseados na substituição de importações.


 						a política de valorização cambial, conciliada ao processo de abertura econômica ainda que sob ditaduras de partido único."
Tigres Asiáticos,"02. (ACAFE) O termo Tigres Asiáticos faz alusão a países ou áreas que se industrializaram, ao longo do século XX, com estratégias de grande competitividade no mercado internacional. Dentro da denominação existem os Tigres Asiáticos (primeira geração) e os Novos Tigres Asiáticos.


 					Assinale a alternativa que contém apenas Tigres Asiáticos de primeira geração.
 					
 						Tailândia, Coreia do Sul e Cingapura.


 						Cingapura, Malásia e Coreia do Sul.


 						Coreia do Sul, Taiwan e Hong Kong.


 						Hong Kong, Taiwan e Filipinas."
Tigres Asiáticos,"03. (FGV-SP) Os Tigres Asiáticos, contemplados por políticas internacionais contra o avanço sino-soviético, industrializaram-se com grande rapidez e apresentaram importantes avanços econômicos nas últimas décadas do século XX.


 					Nesse contexto, esses países se tornaram
 					
 						 centros logísticos, controlando a oferta de bens de consumo no mundo ocidental.


 						áreas de livre comércio, utilizando moeda única para ampliar a troca de mercadorias.


 						tecnopolos, adotando o compartilhamento de patentes em inovações produtivas.


 						plataformas de exportação, oferecendo produtos industriais mais baratos.


 						mercados emergentes, criando relações equânimes entre burguesia e proletariado."
Tigres Asiáticos,"04. (FATEC) Nas décadas de 1960 e 1970, Coreia do Sul, Taiwan, Hong Kong e Cingapura passaram por um intenso processo de industrialização e, posteriormente, ficaram conhecidos como Tigres Asiáticos.



 					Além de mão de obra abundante e barata, esses lugares se caracterizavam por possuir

 					
 						pequenas quantidades de matérias-primas e ter a produção industrial voltada para o mercado externo.


 						reduzida participação estrangeira na produção industrial, assumida por empresas nacionais de capital privado.


 						grandes reservas de matérias-primas para abastecer as indústrias produtoras de bens de consumo duráveis.


 						enorme mercado consumidor, que era abastecido por mercadorias produzidas por indústrias estatais latino-americanas.


 						diversos centros de distribuição de produtos industrializados, que eram fabricados por empresas estatais de capital soviético."
Tigres Asiáticos,"05. (FAAP) Os países conhecidos como Tigres Asiáticos, que se destacam por uma grande pujança econômica, caracterizam-se, basicamente, por:

 					
 						apresentarem economia baseada no setor primário com emprego de numerosa mão de obra;


 						serem altamente industrializados, porém muito dependentes de matérias-primas;


 						exibirem elevados índices de produção de petróleo e aço;


 						apresentarem agricultura basicamente extensiva e de alta tecnologia;


 						apresentarem elevada produção industrial destinada essencialmente ao mercado interno."
Tigres Asiáticos,"06. (UCS) A partir dos anos 70, outros países se juntaram ao Japão na categoria dos que se destacam pela rapidez dos processos de industrialização: são conhecidos como Tigres Asiáticos. Destacam-se por apresentarem elevada produção industrial destinada essencialmente ao mercado externo. São eles:

 					
 						 China, Coreia do Sul, Cingapura e Taiwan.


 						Coreia do Sul, Hong Kong, Cingapura e Taiwan.


 						China, Coreia do Sul, Coreia do Norte e Malásia.


 						Vietnã, Malásia, Cingapura e Filipinas.


 						Coreia do Sul, Malásia, Vietnã e Cingapura."
Tigres Asiáticos,"07. (UEMG) Os chamados “Tigres Asiáticos” são pequenos países industrializados do Extremo Oriente, exportadores de produtos eletrônicos e brinquedos, que atingiram elevados níveis de industrialização, na segunda metade do século XX.

 					São fatores econômicos que favoreceram o desenvolvimento alcançado por esses países, EXCETO:

 					
 						 Investimento de capital estrangeiro, principalmente alemão e japonês.
 						Exploração da força de trabalho, relativamente barata.
 						Modelo econômico que enfatiza o “equilíbrio” social e a hierarquia.
 						Economias voltadas fundamentalmente para o mercado externo."
Tigres Asiáticos,"08. (UNITAU) Apesar das críticas, nos últimos tempos, alguns países superaram o subdesenvolvimento. São os NIC (Newly Industrialized Countries), também conhecidos como ""Tigres Asiáticos"". São eles:

 					
 						 Coreia do Sul, Coreia do Norte, China e Taiwan (Formosa).

 						 Hong Kong, Taiwan (Formosa), China e Coreia do Sul.

 						 Taiwan (Formosa), Cambodja, Coreia e China.

 						 China, Coreia, Hong Kong e Cingapura.

 						 Coreia do Sul, Hong Kong, Taiwan (Formosa) e Cingapura."
Tigres Asiáticos,"09. (UNIPAM) A partir do início dos anos 1980, quatro países da Ásia (Cingapura, Hong Kong, Coreia do Sul e Taiwan) apresentaram um acelerado processo de industrialização. Em razão da agressividade administrativa e da localização dos países, eles ficaram conhecidos mundialmente como Tigres Asiáticos.
 					(CERQUEIRA, W. Tigres asiáticos. Disponível em: http://www.brasilescola.com. Acesso em: 15 set. 2013).

 					Assinale a alternativa CORRETA sobre o processo de industrialização dos Tigres Asiáticos.
 					
 						 Industrialização orientada para a plataforma de exportação de commodities.


 						Modelo econômico industrial endógeno via processo de substituição de importações.


 						Desenvolvimento nas áreas de indústria e tecnologia voltado para o mercado externo.


 						Atração de investimentos de capital estrangeiro, principalmente chinês, que alavancaram o desenvolvimento industrial voltado para o exterior."
Tigres Asiáticos,"10. (FGV-SP) Na distribuição da indústria no mundo, além de fatores histórico-políticos, há também os chamados “fatores locacionais”. No caso dos Tigre

 					
 						 existência de mão de obra qualificada e extensa rede de comunicações.
 						 grande mercado consumidor interno e densa rede de transportes.
 						 disponibilidade própria de matérias-primas minerais e mão de obra barata.
 						 incentivos fiscais governamentais e disponibilidade de terras baratas no interior.
 						 recursos energéticos (petróleo e gás natural) e incentivos fiscais."
Tigres Asiáticos,"11. (Mackenzie-SP) A arrancada industrial dos Tigres Asiáticos, pós-Segunda Guerra Mundial, coincide com a implantação da Guerra Fria no mundo bipolarizado da época. Esse fato só foi possível em virtude:

 					
 						 da ajuda financeira recebida na época do tesouro japonês, que sempre defendeu seus interesses econômicos na região.
 						 da poupança interna desses países que, mesmo antes da Segunda Guerra Mundial, já controlavam suas importações, estimulando as exportações de bens de consumo duráveis.
 						 da ajuda financeira norte-americana, por meio do Plano Colombo, uma forma de instalar o cordão sanitário na região.
 						 da ajuda financeira soviética, que visava ampliar sua área de influência por toda a região.
 						 da ajuda financeira mútua entre os países do bloco, que trocavam entre si matérias primas, tecnologias e uma intensa abertura do mercado consumidor de toda a região."
Tigres Asiáticos,"12. (Unifor-CE) Os “velhos tigres asiáticos”, entre os quais se destaca a Coreia do Sul, apresentaram uma situação bastante original: de simples montadores para exportação passaram a desenvolver tecnologia e, hoje, destacam-se como áreas de industrialização avançada. Pode-se apontar como um dos fatores responsáveis por essa transformação

 					
 						 as abundantes jazidas de minérios e combustíveis fósseis.
 						 a presença de sindicatos fortes e combativos.
 						 os investimentos maciços em educação e em pesquisas tecnológicas.
 						 o forte crescimento vegetativo que criou um grande mercado consumidor.
 						 a presença de Estados democráticos que exaltam a participação popular."
Tigres Asiáticos,"13. (UEMG) Os chamados “Tigres Asiáticos” são pequenos países industrializados do Extremo Oriente, exportadores de produtos eletrônicos e brinquedos, que atingiram elevados níveis de industrialização, na segunda metade do século XX. São fatores econômicos que favoreceram o desenvolvimento alcançado por esses países, EXCETO:

 					
 						 Investimento de capital estrangeiro, principalmente alemão e japonês.
 						 Exploração da força de trabalho, relativamente barata.
 						 Modelo econômico que enfatiza o “equilíbrio” social e a hierarquia.
 						 Economias voltadas fundamentalmente para o mercado externo."
Tigres Asiáticos,"14. (EsPCEx) Alguns países do sudeste asiático superaram o subdesenvolvimento, demonstrando nas últimas décadas grande crescimento econômico. Esses países são denominados de tigres asiáticos e têm-se caracterizado ao longo desse período principalmente por apresentarem

 					
 						 uma economia baseada na agricultura de exportação.
 						 industrialização com ênfase na participação de capital nacional.
 						 uma produção industrial voltada basicamente para o mercado interno.
 						 pequena concentração de capital, apesar de possuírem as maiores taxas de desenvolvimento da Ásia.
 						 um grande desenvolvimento industrial, impulsionado por investimentos externos."
Tigres Asiáticos,"15. (UFJF) Leia o fragmento de texto a seguir.
 					“A partir da década de 1980, alguns territórios do Pacífico ocidental começaram a apresentar altos índices de crescimento econômico e interferência no mercado mundial, sendo por isso designados tigres asiáticos. Os termos lembram agressividade e é exatamente essa a característica fundamental das quatro economias que formam esse grupo. Eles utilizaram estratégia arrojada de atração de capital estrangeiro – apoiada na mão-de-obra barata e disciplinada, na isenção de impostos e nos baixos custos de instalação de empresas”.
 					Uma das quatro economias que formam esse grupo é:

 					
 						 Austrália.
 						 Cingapura.
 						 Índia.
 						 Indonésia.
 						 Japão."
Blocos Econômicos,"01. (MACK-SP) Ao contrário da União Europeia, o Mercosul não pode ser considerado um verdadeiro mercado comum, pois:

					
						 após várias tentativas frustradas, desistiu de unificar as moedas.

						 não pratica a livre circulação de serviços, capitais e pessoas.

						 é integrado por países que apresentam notável similaridade econômica, histórica e cultural.

						 não exige dos países-membros compromissos com a manutenção do regime democrático.

						 está vinculado à União Europeia, para fazer frente à ALCA, que o impede de ser um bloco econômico autônomo."
Blocos Econômicos,"02. (CEFET-CE) A iniciativa para as Américas, lançada pelo presidente George Bush em junho de 1990, se inseria na orientação reformista: a sua meta consistia na formação de uma zona de livre comércio em todo o continente americano, com a exclusão de Cuba. Essa zona de integração econômica é chamada de:

					
						Mercado Comum do Sul (Mercosul).

						 União Europeia.

						 Área de Livre Comércio das Américas (ALCA).

						 Zona da Bacia do Pacífico.

						 Novos Países Industrializados (NPIs)."
Blocos Econômicos,"03. (URCA) Os blocos econômicos são agrupamentos de países de uma mesma região ou mesmo continente, com o objetivo de estabelecer relações comerciais entre si, visando a melhoria do mercado e das relações diplomáticas. Contudo, só no ano de 2018 temos assistido a mudanças na configuração de alguns blocos, como a saída do Reino Unido da União Europeia, as promessas do presidente Donald Trump de retirar os Estados Unidos do Nafta, assim como as discussões que poderão levar a exclusão da Venezuela do Mercosul. Com base neste enunciado é CORRETO afirmar:

					
						Está sendo concretizado um novo momento político e econômico global que levará ao fim dos blocos econômicos.


						 A existência dos blocos econômicos assegura a manutenção da bipolaridade mundial.


						 Na América Latina o processo de integração econômica se deu com a formação da ALCA, logo após o fim da Segunda Guerra Mundial.


						 O momento assistido da integração econômica global revela uma combinação de motivos políticos e econômicos que levarão a reconfiguração dos atuais blocos.


						 A associação de países em blocos econômicos revela a incapacidade de abertura dos mercados para a competitividade global."
Blocos Econômicos,"04. (UFRN) No contexto da globalização, uma tendência crescente é a formação de blocos econômicos regionais. Esses blocos apresentam diferentes níveis de integração. Um desses níveis é a zona de livre comércio que se caracteriza pela:

					
						 criação de uma moeda única a ser adotada pelos países membros.
						 livre circulação de mercadorias provenientes dos países membros.
						 unificação de políticas de relações internacionais entre os países membros.
						 livre circulação de pessoas, serviços e capitais entre os países membros."
Blocos Econômicos,"05. (UNIFEI) A União Europeia (EU) entrou em vigor em novembro de 1992, de acordo com o chamado Tratado de Maastricht, assinado em dezembro de 1991. É constituída por um bloco de países europeus ocidentais que visa a:
					
						 Estabelecer critérios para a redução da imigração e manter a alta qualidade de vida existente na Europa.

						 Consolidar a economia entre os países-membros, tornando-os um mercado único e altamente competitivo no mundo.

						 Combater e erradicar o fundamentalismo religioso muçulmano, com a tomada de medidas antiterroristas.

						 Impedir o crescimento econômico de países emergentes, como a China, e competir com o forte e tradicional mercado norte-americano."
Blocos Econômicos,"06. (UFPI) A organização dos países em blocos econômicos visa facilitar a economia dos países, estimulando as trocas e a produção. Sobre os principais blocos, suas características e finalidades, assinale a alternativa correta.

					
						 ALCA – constituída por países africanos, promove a valorização de seus produtos, possibilitando a concorrência com a economia asiática.
						 MERCOSUL – reúne todos os países da América Latina e visa ampliar as trocas comerciais e o fluxo de pessoas entre os seus membros.
						 CEI – reúne os países da Europa Ocidental que são liderados pela Inglaterra que, por sua vez, detém a hegemonia econômica desta parte de continente.
						 União Europeia – formada por todos os países da Europa, permite a livre circulação, no continente, de pessoas e mercadorias.
						 NAFTA – formado pelos países da América do Norte, eliminou as barreiras tarifárias entre os seus membros"
Blocos Econômicos,"07. (UNIGIBA) Os processos de integração regional em curso nas últimas décadas tendem a seguir um conjunto de etapas, que inclui:


					I–União Aduaneira;
					II–União Monetária;
					III–Área de Livre Comércio;
					IV–Mercado Comum

					A alternativa que apresenta a sequência da maior à menor integração dessas etapas é:



					
						 I, IV, III e II
						 IV, III, II e I
						 III, I, IV e II
						 II, IV, I e III
						 I, II, III e IV"
Blocos Econômicos,"08. (ACAFE) Em um mundo economicamente globalizado o capital não encontra fronteiras físicas e, desta forma, reina a liberdade de comércio entre os países do mundo. Para um maior fortalecimento das posições econômicas ou para intensificar as relações comerciais entre si, alguns países formam alianças, os blocos econômicos. Sobre os blocos econômicos é correto afirmar, exceto:

					
						 As Zonas de Livre Comércio são acordos comerciais que visam a redução ou eliminação de tarifas aduaneiras entre os países membros do bloco, como é o caso do NAFTA.
						 O Acordo de Livre Comércio da América do Norte (NAFTA) é uma associação de expressão mundial reduzida e se caracteriza pela livre circulação de mercadorias, pessoas, serviços e capitais.
						 Brasil, Argentina, Paraguai, Venezuela e Uruguai, países integrantes do MERCOSUL, compõem um bloco econômico que estabelece as mesmas tarifas de exportação e importação para o comércio internacional fora do bloco.
						 O bloco econômico com maior nível de avanço e de integração econômica é a União Européia, pois, além de participar dos acordos do mercado comum, encontra-se na etapa da união econômica e monetária."
Blocos Econômicos,"09. (UFRGS) Considere as seguintes afirmações sobre a crise do Euro e a geopolítica na Europa.
					I – Uma das razões da crise do Euro é a dificuldade de alguns países europeus na manutenção de uma política de bem-estar social em uma economia neoliberal.
					II – Países como Portugal, Espanha, Itália, e Grécia baixaram seus custos e retomaram as barreiras alfandegárias internas.
					III – o déficit orçamental da Grécia fez com que os investidores exigissem taxas de juros muito altas para emprestar dinheiro ao país.
					Quais estão corretas?

					
						 apenas I
						 apenas II
						 apenas I e II
						 apenas I e III
						 I, II e III"
Blocos Econômicos,"10. (Unimontes) Após a Segunda Guerra Mundial, além de se formarem os grandes blocos, diversos países se reuniram em organizações geopolíticas e econômicas, constituindo blocos econômicos regionais de diversos tipos.

					 Fonte: TERRA, L. e COELHO, M. de A. Geografia Geral e Geografia do Brasil: O espaço natural e socioeconômico. São Paulo: Moderna, 2005.

					Considerando a integração econômica que ocorre no interior dos blocos regionais, relacione as colunas.

					1) Mercado Comum

					2) Zona de livre comércio

					3) União aduaneira

					_______________________

					( ) Circulação de bens com taxas alfandegárias reduzidas ou eliminadas.

					( ) Padronização de tarifas para diversos itens relacionados ao comércio com países que não pertencem ao bloco.

					( ) Livre circulação comercial e financeira de pessoas, bens e serviços.

					Assinale a sequência correta.


					
						 1, 2, 3.

						 3, 2, 1.

						 2, 3, 1.

						 2,1, 3."
Mercosul,"01. MACK-SP) Ao contrário da União Europeia, o Mercosul não pode ser considerado um verdadeiro mercado comum, pois: 

					
						 após várias tentativas frustradas, desistiu de unificar as moedas.

						 não pratica a livre circulação de serviços, capitais e pessoas.

						 é integrado por países que apresentam notável similaridade econômica, histórica e cultural.

						 não exige dos países-membros compromissos com a manutenção do regime democrático.

						 está vinculado à União Europeia, para fazer frente à ALCA, que o impede de ser um bloco econômico autônomo."
Mercosul,"02. (Mackenzie) Considere as afirmações sobre o Mercosul e suas relações com os EUA: 

					I – Entre os países membros não há nenhum pólo gerador de tecnologias. Brasil e Argentina são as economias mais industrializadas, mas muito dependentes de capitais e equipamentos estrangeiros; dessa forma não há como conseguir auto-suficiência industrial no interior do Mercosul. 

					II – O Brasil pretende transformar-se num “global trader” (país que comercializa com o mundo todo) e não pretende concentrar os negócios do Mercosul com poucos países, especialmente os EUA. 

					III – O interesse brasileiro é o de adiar a adesão à ALCA (Área de Livre Comércio das Américas), para dar tempo aos setores produtivos de modernizaremse para enfrentar a concorrência dos EUA. 

					IV – Os EUA querem apressar a adesão à ALCA, pois visam ter um mercado cativo na América do Sul, ao mesmo tempo em que restringiriam os interesses da União Européia na região. 

					São verdadeiras: 


					
						 I, II, III e IV

						 apenas II e III e IV

						 apenas II e III

						 apenas I e III e IV

						 apenas III e IV"
Mercosul,"03. (UFRRJ) A Argentina, o Brasil, o Paraguai e o Uruguai formam o Mercosul (Mercado Comum do Sul), o organismo que estabelece as regras e os procedimentos para a integração econômica entre os quatro países. Sobre esse bloco econômico, é correto afirmar que: 

					
						integra países com povoamento, dinâmica econômica e nível de renda muito diferentes.

						 estabelece “fronteiras abertas” para o livre deslocamento de pessoas, produtos e capitais.

						 permite a livre circulação dos bens industriais sem restrições e barreiras alfandegárias.

						 restringe os fluxos migratórios devido às rivalidades históricas existentes dentro do bloco."
Mercosul,"04. (Fei) Um dos fatos que mais chamam a atenção no mundo contemporâneo é a formação dos chamados blocos econômicos. O Brasil vem aprofundando os entendimentos com os seus parceiros do MERCOSUL para melhor operacionalizar essa união. São parceiros do Brasil no MERCOSUL: 

					
						 Argentina, Uruguai e Chile

						 Argentina, Bolívia e Paraguai
						 Uruguai, Argentina e Peru

						 Argentina, Paraguai e Uruguai

						 Chile, Paraguai e Argentina"
