Tema,Pergunta
Agropecuária,"01. (UEL) O Brasil é líder mundial no consumo de agrotóxicos, com 7,3 litros por ano para cada habitante, e o número de veneno no prato do brasileiro aumentou consideravelmente nos últimos três anos (de 2016 a 2018). O Brasil caminha para a liberação do aumento do número de novos registros de agrotóxicos e afins, ficando na contramão de países europeus e dos EUA.  
					Evolução do número de novos registros de agrotóxicos e afins no Brasil  

					


					Com base no gráfico e nos conhecimentos sobre a utilização dos agrotóxicos, considere as afirmativas a seguir.



					I. O aumento do número de novos registros de agrotóxicos e afins entre os anos de 2015 e 2018 foi de 363%, contribuindo qualitativamente com a segurança alimentar e a biodiversidade.
					II. Em função da aplicação dos agrotóxicos, há a contaminação das águas e dos horizontes do solo, afetando a biota, podendo até tornar o solo estéril.
					III. Algumas classes de pesticidas promovem a desorientação espacial e a morte das abelhas, prejudicando a polinização de determinadas lavouras e causando a queda na produção.
					IV. A opção por um modelo de desenvolvimento baseado em latifúndios monocultores voltados para a exportação, aliada a políticas de redução e isenção de impostos, incentiva o uso desses produtos.



					Assinale a alternativa correta.  
					
						 Somente as afirmativas I e II são corretas.


						Somente as afirmativas I e IV são corretas.


						Somente as afirmativas III e IV são corretas.


						Somente as afirmativas I, II e III são corretas.


						Somente as afirmativas II, III e IV são corretas."
Agropecuária,"02. (UEFS) Este tipo de agricultura foi introduzido pelos europeus em suas colônias tropicais a partir do século XVI. Com as transformações na agricultura, passou a ser um sistema intensivo de capitais, mas continua a ser um sistema latifundiário e monocultor de produtos tropicais, voltados para a exportação.  

					O texto se refere ao sistema agrícola  
					
						rotação de terras.


						agricultura familiar.


						plantation.


						rotação de culturas.


						agricultura de jardinagem."
Agropecuária,"03. (PUC-RS) Ampliando-se o público, ampliaram-se os jornais e as revistas em circulação. Fundaram-se associações artísticas e musicais em várias cidades. Aumentou a sociabilidade. Atenuou-se a disciplina rígida do patriarcalismo que segregava no lar a mulher de classe média e alta. A crescente diversificação ocupacional nos grandes centros urbanos tornou mais complexa a estrutura social.  

					(VIOTTI DA COSTA, Emília. Da monarquia à República. Momentos decisivos. São Paulo: Grijaldo, 1977).  

					 Considerando o texto acima, é correto afirmar que, no contexto do final do século XIX, na região sudeste do Brasil, a urbanização estava associada às mudanças econômicas e sociais de uma/do _________ para uma/a _________, baseada na mão de obra _________ 
					
						 economia agrícola de exportação do café – economia industrial – livre


						economia agrícola de subsistência – economia comercial da cana de açúcar e do algodão – escrava


						economia agrícola comercial diversificada – economia agrícola de exportação do café – escrava


						extrativismo mineral – agricultura de subsistência – livre imigrante"
Agropecuária,"04. (UERJ)  


					


					 Uma característica econômica comum aos quatro cultivos brasileiros nos quais os agrotóxicos são mais utilizados é a expressiva: 

					
						 relevância na pauta de exportação


						participação na absorção de mão de obra


						centralidade na alimentação da população


						influência na desconcentração da propriedade"
Agropecuária,"05. (UFRN) Desde as últimas décadas do século XX, o Brasil avança no processo de modernização no campo, o que levou alguns autores a identificar a configuração de um “novo rural”, representado especialmente pelo agronegócio, que  

					
						 designa toda uma cadeia de produção que tem como atividade básica a agropecuária com elevada produtividade da terra, resultante da aplicação de tecnologias avançadas e do forte investimento de capitais.


						prioriza basicamente a agropecuária e, assim, promove uma subordinação da cidade ao campo, em decorrência do elevado emprego de tecnologias avançadas e do forte investimento de capitais.


						designa toda uma cadeia de produção que se realiza efetivamente no campo, tendo a agropecuária como foco, e, sendo assim, apresenta baixa capacidade de articular as relações entre o rural e o urbano.


						prioriza basicamente a agropecuária e, assim, enfrenta dificuldades de expansão tendo em vista a intensificação dos processos de urbanização e de crescimento do setor terciário que ocorrem nas diferentes regiões do país."
Agropecuária,"06. (FATEC) O Brasil é um dos maiores exportadores de commodities do mundo.  

					Chamamos de commodities produtos de base  
					
						 primária, principalmente pesqueira e do setor têxtil.


						primária, principalmente agrícola e de extração mineral.


						secundária, principalmente industrial e eletroeletrônica.


						secundária, principalmente siderúrgica e metalúrgica.


						terciária, principalmente bancária e de produtos hospitalares."
Agropecuária,"07. (UECE) A economia do Ceará registrou retração de 5,32% no segundo trimestre de 2015, desempenho muito inferior ao registrado no segundo trimestre de 2014, com relação ao mesmo período de 2013, quando foi verificado um crescimento de 3,04%. No acumulado do ano, observa-se uma queda de 2,14%. Os números do Produto Interno Bruto (PIB) cearense, que é a soma de todos os bens e serviços produzidos no Estado e que serve para medir o comportamento da economia cearense foram divulgados nesta quinta-feira (10), pelo Instituto de Pesquisa e Estratégia Econômica do Estado (Ipece).  
					 Economia do Ceará tem retração de 5,32% no segundo trimestre, diz Ipece. http://g1.globo.com/ceara/noticia/2015/09/economia-doceara-tem-retracao-de-532-no-primeiro-trimestre-dizipece.html 

					Dentre as causa desse processo de recessão da economia cearense encontra-se  
					
						o aumento das importações de roupas e calçados, artigos tradicionalmente produzidos no Ceará.


						as dificuldades enfrentadas pelo setor pesqueiro que representa a principal indústria do Ceará.


						a retração de setores como agropecuária, indústria e serviços, acompanhando a tendência brasileira.


						a diminuição da arrecadação de impostos pelo governo estadual e pelos municípios."
Agropecuária,"08. (UEA) Principal grão do Brasil, foi introduzido no país em 1914. A partir da década de 1970, o setor registrou alto crescimento graças à migração de produtores do Sul, com o desenvolvimento de novas técnicas de cultivo e do uso de pesticidas. “Os preços aumentavam e os produtores do Sul não tinham terra suficiente para desenvolver. Muitos se instalaram no Cerrado, onde transformaram terras baratas, que eram inóspitas para o plantio da oleaginosa”, disse Amélio Dall’Agnol, da Embrapa.  
					(www.afp.com, 15.06.2019. Adaptado.)  

					O grão e a região brasileira que abrigou a sua primeira frente de expansão são  
					
						 a soja e o Sudeste.


						o milho e o Sudeste.


						o milho e o Centro-Oeste.


						a soja e o Centro-Oeste.


						a soja e o Norte."
Agropecuária,"09. (USP) É preocupante a detecção de resíduos de agrotóxicos no planalto mato-grossense [Planaltos e Chapada dos Parecis], onde nascem o rio Paraguai e parte de seus afluentes, cujos cursos dirigem-se para a Planície do Pantanal. Em termos ecológicos, o efeito crônico da contaminação, mesmo sob baixas concentrações, implica efeitos na saúde e no ambiente a médio e longo prazos, como a diminuição do potencial biológico de espécies animais e vegetais.  

					Dossiê Abrasco – Associação Brasileira de Saúde Coletiva, Rio de Janeiro/São Paulo: EPSJV/Expressão Popular, 2012. Adaptado.  

					Com base no texto e em seus conhecimentos, é correto afirmar:  
					
						No Mato Grosso do Sul, prevalece a criação de caprinos nas chapadas, ocasionando a contaminação dos lençóis freáticos por resíduos de agrotóxicos


						No Mato Grosso, ocorre grande utilização de agrotóxicos, em virtude, principalmente, da quantidade de soja, milho e algodão nele cultivada


						Em Goiás, com o avanço do cultivo da laranja transgênica voltada para exportação, aumentou a contaminação a montante do rio Cuiabá


						No Mato Grosso, estado em que há a maior área de silvicultura do país, há predominância da pulverização aérea de agrotóxicos sobre as florestas cultivadas


						No Mato Grosso do Sul, um dos maiores produtores de feijão, trigo e maçã do país, verificase significativa contaminação do solo por resíduos de agrotóxicos"
Agropecuária,"10. (UEMG) Sobre a Estrutura Fundiária Brasileira, assinale a alternativa correta.  

					
						As pequenas propriedades rurais são em maior número e ocupam mais da metade das terras do território brasileiro.


						A maior parte dos latifúndios está situada em áreas de expansão das fronteiras agrícolas, pecuárias e de exploração mineral.


						A média propriedade rural é numericamente predominante na Região Sul, nomeadamente nos Estados do Paraná e de Santa Catarina.


						A Sub-região do Nordeste, o Agreste, é caracterizada pela predominância quantitativa das médias e grandes propriedades rurais."
China,"01. (Enem 2011) Os chineses não atrelam nenhuma condição para efetuar investimentos nos países africanos. Outro ponto interessante é a venda e compra de grandes somas de áreas, posteriormente cercadas. Por se tratar de países instáveis e com governos ainda não consolidados, teme-se que algumas nações da África tornem-se literalmente protetorados.



					BRANCOLI, F. China e os novos investimentos na África: neocolonialismo ou mudanças na arquitetura global? Disponível em: http://opiniaoenoticia.com.br. Acesso em: 29 abr. 2010 (adaptado).

					A presença econômica da China em vastas áreas do globo é uma realidade do século XXI. A partir do texto, como é possível caracterizar a relação econômica da China com o continente africano?

					
						 Pela presença de órgãos econômicos internacionais como o Fundo Monetário Internacional (FMI) e o Banco Mundial, que restringem os investimentos chineses, uma vez que estes não se preocupam com a preservação do meio ambiente.

						Pela ação de ONGs (Organizações Não Governamentais) que limitam os investimentos estatais chineses, uma vez que estes se mostram desinteressados em relação aos problemas sociais africanos.

						Pela aliança com os capitais e investimentos diretos realizados pelos países ocidentais, promovendo o crescimento econômico de algumas regiões desse continente.

						Pela presença cada vez maior de investimentos diretos, o que pode representar uma ameaça à soberania dos países africanos ou manipulação das ações destes governos em favor dos grandes projetos.

						Pela presença de um número cada vez maior de diplomatas, o que pode levar à formação de um Mercado Comum Sino-Africano, ameaçando os interesses ocidentais."
China,"02. (Enem 2016) No início de maio de 2014, a instalação da plataforma petrolífera de perfuração HYSY-981 nas águas contestadas do Mar da China Meridional suscitou especulações sobre as motivações chinesas. Na avaliação de diversos observadores ocidentais, Pequim pretendeu, com esse gesto, demonstrar que pode impor seu controle e dissuadir outros países de seguir com suas reivindicações de direito de exploração dessas águas, como é o caso do Vietnã e das Filipinas.

					KLARE, M.T. A guerra pelo petróleo se joga no mar. Le Monde Diplomatique Brasil, abr. 2015.

					 A ação da China em relação à situação descrita no texto evidencia um conflito que tem como foco o(a)

					
						 Distribuição das zonas econômicas especiais.

						Monopólio das inovações tecnológicas extrativas.

						Dinamização da atividade comercial.

						Jurisdição da soberania territorial.

						Embargo da produção industrial."
China,"03. (Cesgranrio) “Xangai – A população chinesa deve chegar a 1,442 bilhão de pessoas em 2029 e começar um longo período de declínio “imparável” em 2030, disseram acadêmicos do governo em um estudo. [...] A população da China deve cair para 1,36 bilhão em 2050, o que pode significar um declínio na força de trabalho da ordem de 200 milhões de pessoas. Se as taxas de natalidade continuarem nos patamares atuais, a população deve chegar a 1,18 bilhão em 2065.”

					Disponível em: https://exame.abril.com.br/mundo/populacao-da- -china-deve-atingir-pico-de-144-bilhao-em-2029/. Acesso em: 15 jan. 2019. Adaptado.



					 Se as previsões citadas na reportagem se confirmarem, qual será a redução média anual na população chinesa, em milhões de habitantes, de 2050 a 2065?

					
						 0,8

						1,7

						4,8

						12,0

						17,3"
China,"04. (FAMERP) Tradicionalmente, diplomatas dos Estados Unidos, dos países árabes e da União Europeia tentam mediar o conflito de décadas entre Israel e os palestinos. Mas quem também anda viajando pela região é o enviado especial chinês, Wu Sike, um nome desconhecido em grande parte do Ocidente. Ele já esteve na Arábia Saudita, no Catar, na Jordânia, no Egito, nos territórios palestinos e em Israel, não só representando os interesses econômicos chineses, mas também agindo como mediador entre Israel e o Hamas.

					(www.folha.uol.com.br, 29.07.2014.)

					O interesse da China em estender sua influência econômica e diplomática no Oriente Médio justifica-se

					
						por sua política de importação de alimentos cultivados junto ao Mar Mediterrâneo.

						por seu objetivo imperialista de conquistar a hegemonia política na porção oriental do globo.

						 por seus acordos de cooperação técnico-científica na área do meio ambiente.
						por sua dependência energética das importações de petróleo dos Estados do Golfo.

						por sua vocação humanitária ao difundir práticas que ajudaram a melhorar os indicadores sociais chineses."
China,"05. (ESPM) O contexto internacional em 2019 no segundo semestre, entre outros fatos, foi marcado pela crise envolvendo China e Hong Kong.



					Sobre o status político de Hong Kong é correto afirmar:

					
						 É um Estado soberano, condição alcançada logo após a independência do Reino Unido em 1997.

						É uma região autônoma britânica encravada em território chinês.

						É uma região administrativa com status especial, porém sob soberania chinesa.

						É uma região administrativa autônoma e com status especial, porém atrelada à Taiwan.

						É considerada um Estado independente, porém a China não reconhece essa condição."
China,"06. (EMESCAM) Sobre Hong Kong, que foi devolvido ao governo da China Continental no dia 1º de julho de 1997, depois de 155 anos de domínio britânico, pode-se afirmar que:

					
						 a reincorporação de Hong Kong à China decorreu da adesão desse país ao sistema capitalista.

						a devolução de Hong Kong à China foi consequência do processo de globalização da economia.

						a presença dos ingleses em Hong Kong pode ser entendida como uma prerrogativa da Igreja Anglicana.

						o retorno de Hong Kong ao governo chinês resultou de forte sentimento de nacionalismo de seus habitantes.

						o domínio britânico em Hong Kong decorreu da expansão do imperialismo britânico."
China,"07. (EsPCEx) “Desde o início da década de 1980, a China tem sido a economia que mais cresce no mundo, a uma taxa média de 10% ao ano […]. Como consequência desse impressionante crescimento, entre 1980 e 2010 o PIB chinês aumentou 2.810% e se tornou o segundo maior do planeta.”

					SENE, Eustáquio & MOREIRA, J.C. - Geografia Geral e do Brasil: Espaço Geográfico e Globalização (2). 2ª ed. São Paulo: Moderna, 2012, p.199.



					Dentre os fatores associados a esse avanço econômico podem-se destacar:



					I- a presença de enormes reservas de minérios e combustíveis fósseis no subsolo chinês que concede ao País autossuficiência em termos de matéria-prima e fontes de energia e o caracteriza como grande exportador mundial de petróleo.

					II- o modelo de economia planificada que, promovendo crescimento econômico com equilibrada distribuição de renda, amplia o mercado consumidor interno chinês, um dos mais gigantescos do mundo, e elimina as desigualdades sociais.

					III- a liberalização econômica e os baixos custos da mão de obra, principal fator de competitividade da indústria chinesa, têm sido fundamentais para o crescimento econômico do País.

					IV- o esforço chinês em atrair indústrias intensivas em capital para as chamadas zonas de desenvolvimento econômico e tecnológico, fazendo com que nas últimas décadas o País esteja entre os maiores receptores de investimentos produtivos do mundo.



					Assinale a alternativa em que todas as afirmativas estão corretas.

					
						 I e II

						I e III

						I e IV

						II e III

						III e IV"
China,"08. (FAAP) A China, com mais de 1 bilhão e 357 milhões de habitantes e organizada como uma república parlamentar socialista, tem atraído a atenção dos países capitalistas pela nova política econômica que foi implantada após a morte de Mao Tse-Tung.



					Sobre as reformas implantadas na China a partir de 1978, é correto afirmar que:

					
						o governo chinês permitiu o estabelecimento de um comércio ativo com outros países e a instalação de fábricas de transnacionais em solo chinês. Foram criadas as Zonas Econômicas Especiais, no litoral chinês.

						após o longo processo de independência britânica , na primeira metade do século XX, os primeiros governos nacionais procuraram promover o crescimento econômico com a ajuda dos EUA e do Fundo Monetário Internacional (FMI).

						o governo chinês, para tentar solucionar a crise, desenvolveu um programa de reformas econômicas no país denominado perestroika . Por meio desse programa, ocorreu uma nova direção no desenvolvimento do setor industrial voltado para a produção de bens de consumo e material bélico.

						a elevada incidência de pobreza no país tem raízes na economia colonial. Desse modo grande parte da população ficou marginalizada do mercado consumidor.

						as reformas econômicas foram responsáveis pela criação das “ZEEs”na região oeste e central do país, com infraestrutura construída pelos investidores estrangeiros."
China,"09. (PUC-PR) Hu Jintao (dirigente chinês) foi substituído em março de 2013 por Xi Jinping que terá desafios importantes a enfrentar na 2a maior economia do planeta: corrupção, degradação ambiental, desaceleração do crescimento econômico entre outros.



					Com relação à China, assinale a alternativa CORRETA.

					
						 A abertura econômica transformou a China numa das maiores plataformas de exportação de bens de consumo do mundo. Na atualidade, está entre os principais parceiros comerciais do Brasil, destacando-se em nossa pauta de exportações para esse país, a soja e o minério de ferro.

						A China, apesar de não ser membro do Conselho de Segurança da ONU (Organização das Nações Unidas), possui participação importante nas grandes decisões mundiais tendo apoiado os Estados Unidos nos últimos conflitos ocorridos no Norte da África e Oriente Médio.

						Apesar da crescente industrialização, o governo chinês não demonstra preocupação ambiental, visto que sua matriz energética é predominantemente limpa e renovável.

						Recentemente, a China deu total autonomia à região do Tibete, encerrando um longo período de dominação dessa região por Pequim.

						O crescimento chinês iniciou-se com a implantação do “socialismo de mercado” através das Zonas Econômicas Especiais, programa desenvolvido por Mao Tsé-Tung com apoio, na época, dos Estados Unidos e da Ex-URSS."
China,"10. (UESB) Se um meteoro caísse na China e ela sumisse do mapa amanhã, a balança comercial brasileira não apenas despencaria, mas mudaria de sinal. [...] Nessa conjectura apocalíptica, os Estados Unidos, cujo gigantesco déficit a China financia, ficariam insolventes. Pequenos, médios e grandes negócios fechariam as portas. A Europa também viria a nocaute, sem gordura para queimar e com países ancorados na exportação de maquinário. O Japão, que tem 20% de suas exportações direcionadas para a China, entraria em colapso, o mesmo destino dos vizinhos asiáticos Bangladesh e Vietnã, hoje satélites chineses.

					 (OYAMA, 2012, p. 100).

					 O texto e os conhecimentos sobre a dualidade chinesa de um governo comunista, que desenvolve uma economia capitalista, permitem concluir que a China contemporânea

					
						 absorveu, em grande parte, a cultura ocidental, restringindo as expressões de sua cultura tradicional às comemorações nacionais.

						vê sua economia favorecida pela grande disponibilidade de mão de obra qualificada nas áreas rurais.

						conserva o ideal socialista de uma sociedade com poucos contrastes sociais, promovendo programas intensos de distribuição de renda.

						tem influência na economia mundial, beneficiada, em grande parte, pelo fenômeno da globalização e pela integração entre os mercados.

						desenvolve programas de austeridade, destinados ao controle do consumismo, considerado incompatível com os ideais do Estado comunista."
China,"11. (ESPM) Dirigentes de China e Taiwan tiveram em Nanquim, o primeiro encontro desde a guerra civil de 1949. Foram quatro dias de conversações entre o chinês Wang Yu-Chi e o taiwanês Zhang Zhijuni. Tratou da continuação e contatos que ocorriam de forma discreta, apesar de ousada, desde maio de 2008, quando Maying Jeou foi eleito presidente da ilha de 23 milhões de habitantes. Voos regulares passaram a encurtar distâncias, e o fluxo comercial entre as duas partes dobrou. Em 2013, chegou a antes inimagináveis US$ 197 bilhões. Em 2010, China e Taiwan já haviam firmado um acordo comercial, sustentado por organismos não oficiais. No ano passado a ilha capitalista recebeu 3 milhões de turistas oriundos da China, país de 1,4 bilhão de habitantes, que passou por uma revolução comunista em 1949, liderada por Mao Tse-Tung.

					(http://zerohora.clicrbs.com.br/rs/mundonoticia/2014; 01/03/2014; 11h56)

					Oficialmente:

					
						a China considera Taiwan uma Zona Econômica Especial;

						a China reconhece Taiwan como um país independente;

						a China concede a Taiwan o status de província com autonomia especial;

						a China considera Taiwan como uma região administrativa especial;

						a China considera Taiwan como parte de seu território e não reconhece sua independência."
China,"12. (PUC-Rio) China foi o país que mais registrou patentes em 2012 — Brasil está na 28º colocação entre as nações que mais pedem patentes de produtos.

					Época Negócios Online. Disponível em: <http://epocanegocio.globo.com/informacao/Resultados/noticia/2013/12>. Acesso em: 14 mai. 2014



					 O título da reportagem selecionada mostra que a potência oriental:

					
						 é a que mais pirateia marcas no mundo.

						importa a cada ano mais matérias primas.

						ultrapassou o Brasil nos investimentos de ponta.

						investe crescentemente em Ciência e Tecnologia (C&T).

						acatou a legislação da Organização Mundial do Comércio (OMC)."
China,"13. (UESB) Os conhecimentos sobre a China atual permitem afirmar:

					
						
							A eficiência do mercado de trabalho chinês se deve à erradicação do analfabetismo.

						O país se transformou na “locomotiva asiática”, por promover a desaceleração do crescimento demográfico.

						A preocupação com o desenvolvimento sustentável fez desse país um exemplo para os países emergentes.

						A substituição do modelo soviético por formas de organização mais transparentes possibilitou grandes avanços nos campos científico e tecnológico.

						O padrão de excelência internacional em todos os níveis da educação alcançado pelo país é resultante, entre outros fatores, dos altos salários e privilégios que beneficiam os professores."
China,"14. (EMESCAM) A China se tornou uma potência industrial e exportadora nos últimos anos. Quais as causas desse fenômeno? Avalie se as afirmações são corretas ou incorretas:



					 1 - as vantagens concedidas pelo governo chinês às companhias transnacionais.
					2 - a mão de obra barata e abundante do país.
					3 - a política de liberalização econômica que abriu o país para investimentos estrangeiros.
					4 - a atuação da Comunidade Europeia do Carvão e do Aço (CECA) que unificou fretes e tarifas em toda a região.



					Estão corretas as afirmativas

					
						 1 e 2.

						2 e 3.

						3 e 4.

						1, 2, e 3.

						2, 3 e 4."
