Tema,Pergunta
Inversão Térmica,10. ()
Litosfera,"01. (Fuvest) A Litosfera é fragmentada em placas que deslizam, convergem e se separam umas em relação às outras à medida que se movimentam sobre a Astenosfera. Essa dinâmica compõe a Tectônica de Placas, reconhecida inicialmente pelo cientista alemão Alfred Wegener, que elaborou a teoria da Deriva Continental no início do século XX, tal como demonstrado a seguir. 


					

					As bases da teoria de Wegener seguiram inúmeras evidências deixadas na superfície dos continentes ao longo do tempo geológico. Considerando as figuras e seus conhecimentos, indique o fator básico que influenciou o raciocínio de Wegener. 
					
						 As repartições internas atuais dos continentes no Hemisfério Norte.

						A continuidade dos sistemas fluviais entre América e África.

						As ligações atuais entre os continentes no Hemisfério Sul.

						A semelhança entre os contornos da costa sul‐americana e africana.

						A distribuição das águas constituindo um só oceano."
Litosfera,"02. (EBMSP) Nem a crosta continental nem a oceânica são estáticas. Apesar da aparente estabilidade e rigidez, a litosfera é dotada de dinamismo e alimentada por forças endógenas.


					A litosfera caracteriza-se por 
					
						 funcionar como piso do estrato geográfico, onde são encontrados os recursos naturais.

						apresentar composição física homogênea e composição química heterogênea.

						possuir a mesma espessura tanto na porção terrestre quanto na oceânica.

						apresentar uma estruturação uniforme devido à formação geológica antiga.

						ser composta, na porção oceânica, por rochas predominantemente vulcânicas."
Litosfera,"03. (FATEC) A Teoria da Tectônica de Placas afirma que a crosta terrestre, mais precisamente a litosfera, está fracionada em um determinado número de placas tectônicas rígidas, que se deslocam com movimentos horizontais.
						Em faixas de contato onde ocorrem choques entre as placas tectônicas, uma placa submerge sob outra placa. Esse fenômeno, conhecido como subducção ocorre em bordas 

					
						 destrutivas, quando a pressão entre as placas tectônicas faz com que uma delas mergulhe debaixo da outra.
						divergentes, em decorrência de erupções vulcânicas que colaboram com a deformação e ruptura das placas tectônicas.
						construtivas, devido à ação de forças, verticais ou inclinadas, sobre as placas tectônicas que as fraturam, gerando as falhas.
						conservativas, pois uma placa tectônica, ao deslizar ao longo de outra, provoca o desmoronamento do assoalho oceânico.
						transformantes, em função do movimento lateral da litosfera, que provoca o rebaixamento e o soerguimento das placas tectônicas."
Litosfera,"04. (ACAFE) A litosfera é a camada sólida mais superficial de nosso planeta. Ela é formada por rochas e minerais e faz parte do cenário onde se desenvolve a vida, juntamente com outras camadas ou esferas.


					Sobre a litosfera, todas as alternativas estão corretas, exceto a: 
					
						 As bacias sedimentares resultam de acúmulos de sedimentos em depressões a partir da era Paleozoica e nelas são encontrados os combustíveis fósseis como o carvão mineral e o petróleo.
						A litosfera está dividida em placas tectônicas que flutuam sobre um material pastoso e cujos limites estão sempre em movimento, provocando instabilidades geológicas como vulcanismo e abalos sísmicos.
						As relações entre a litosfera, a atmosfera e a hidrosfera não interferem no modelado terrestre, não afetam o ciclo das águas e nem os fenômenos meteorológicos, pois cada camada ou esfera age independente uma da outra.
						Das três estruturas geológicas que aparecem na crosta terrestre, ou seja, os maciços ou escudos antigos, as bacias sedimentares e os dobramentos modernos, somente a terceira estrutura não existe no Brasil."
Litosfera,"05. (UFRN) Os deslocamentos gerais apresentados pela litosfera são chamados movimentos tectônicos. Muitas dessas ocorrências geológicas acontecem nas bordas das placas que são áreas de tensão entre estas. 

					



					No mapa, localizamos a falha de San Andreas. Assinale, a seguir, o tipo de movimento que ocorre nesta falha. 

					
						 Destrutiva.

						Construtiva.

						Conservativa.

						De subducção."
Litosfera,"06. (UCPEL) De acordo com a Teoria da “Tectônica das Placas”. Admite-se que a litosfera é constituída por placas que se movimentam, provocando uma intensa atividade geológica que resulta, entre outros efeitos, em terremotos e vulcões, principalmente nos limites das placas.

					



					Sobre as Placas Tectônicas, leia as seguintes afirmativas e coloque (V) para as verdadeiras e (F) para as falsas.



						I. Os movimentos das placas são devidos às “correntes de convecção” que ocorrem na astenosfera (camada logo abaixo da litosfera): as correntes de convecção são causadas pelo movimento ascendente dos materiais mais quentes do manto (magma) em direção à litosfera, que, ao chegar à base da litosfera, tende a se movimentar lateralmente e perder calor por causa da resistência desta e depois descer novamente dando lugar a mais material aquecido.

						II. No meio dos oceanos Atlântico, Pacífico e Índico existem cordilheiras que chegam a atingir até 4000 mil metros acima do assoalho oceânico chamadas de Cordilheiras “Meso-oceânicas”. Estas cordilheiras se originam do afastamento das placas tectônicas nas chamadas “zonas de divergência”. São locais onde as correntes de convecção atuam em direções contrárias originando rupturas no assoalho oceânico pelas quais é expelido o magma da astenosfera. Dessa forma, ao esfriar, o magma (ou lava basáltica) causa a renovação do assoalho oceânico.

						III.Outro tipo de movimento das placas tectônicas acontece nas chamadas “zonas de convergência” onde as placas se movimentam em direção contrária uma da outra. Nesse caso, pode acontecer de uma placa afundar por sob a outra nas “zonas de divergência”. Isso acontece entre uma placa oceânica e uma placa continental porque a placa oceânica tende a ser menos densa que a placa continental o que faz com que ela seja “engolida” por esta última. Um exemplo é a zona de divergência da Placa de Nazca em colisão com a Placa continental Sul-Americana e responsável pela formação da Cordilheira Andina.

						IV.Quando o movimento de divergência ocorre entre duas placas continentais de igual densidade, ocorre o soerguimento de cadeias montanhosas como o Himalaia, por exemplo, que está na zona de divergência das placas continentais Euroasiática e Arábica.



						A alternativa que contém a sequência correta de afirmativas verdadeiras (V) e falsas (F) é 
					
						 F, F, V e V.

						V, F, V e F.

						V, V, F e F.

						F, V, F e V.

						V, F, F e V."
Litosfera,"07. (UEFS) Dois grandes conjuntos de fatores, denominados agentes do relevo, modificam, interna e externamente, a configuração da litosfera.

					Sobre os agentes endógenos e exógenos do modelado terrestre, pode-se afirmar: 
					
						 Os deltas e as várzeas são paisagens resultantes, respectivamente, da erosão fluvial e da acumulação pluvial.
						A uniformidade da participação de cada um dos agentes na superfície terrestre justifica o fato de o relevo se encontrar em permanente evolução.
						Os diastrofismos ocasionam, entre outras deformações, falhas e dobramentos na superfície, produzindo vários tipos de relevo.
						O trabalho de erosão glaciária ocorre por ação da gravidade, provocando desgaste nas rochas e dando origem a paisagens, como os tômbolos e as rias.
						Os abalos sísmicos provocados pela acomodação de sedimentos, em razão do seu próprio peso, costumam ser de grande intensidade e estão relacionados ao tectonismo epirogenético."
Litosfera,"08. (ACAFE) A litosfera é a camada superficial de nosso planeta. Ela é importante para a vida.

						Sobre esse tema é correto afirmar, exceto: 

					
						 A litosfera apresenta jazidas minerais de grande interesse econômico que foram formadas por ação de agentes endógenos, como é o caso do ferro, da bauxita e do carvão, encontrados nos escudos ou maciços antigos.

						As relações entre a litosfera, a atmosfera e a hidrosfera envolvem importantes processos como é o caso da erosão modeladora do relevo terrestre.

						A parte mais externa da Terra, também chamada de crosta, é formada por minerais, os quais apresentam elementos químicos na sua composição.

						A camada mais superficial da litosfera – o solo – é o produto final da ação do intemperismo, cuja dinâmica depende dos chamados agentes externos, como é o caso do clima, do relevo e dos seres vivos."
Litosfera,"09. (UEFS) O relevo resulta da dinâmica de fenômenos internos e externos sobre a camada mais superficial da Terra, a litosfera.

						A partir dos conhecimentos acerca dos agentes internos e externos do relevo terrestre, é correto afirmar:

					
						O reajustamento isostático de áreas da superfície terrestre resulta de processos de soerguimento ou rebaixamento de porções da litosfera.

						O diastrofismo orogenético constitui um tipo de deformação estrutural sofrida pelas rochas devido à ação de forças verticais ou inclinadas.

						O intemperismo físico ocorre em função do contato da rocha com a água, provocando reações de destruição dessa rocha, sendo mais intenso nas áreas equatoriais.

						Todo rio, devido à ação erosiva da água, tende a originar deltas e planícies de várzea, cuja forma dependerá do nível de resistência das rochas do seu leito e de suas margens.

						Os vulcões não explosivos aparecem nos pontos de contato entre duas placas tectônicas e caracterizam-se pelo fato de a lava ser quase sólida, em função de sua origem nas profundezas da Terra."
Litosfera,"10. (EBMSP) Nem a crosta continental nem a oceânica são estáticas. Apesar da aparente estabilidade e rigidez, a litosfera é dotada de dinamismo e alimentada por forças endógenas.

						A litosfera caracteriza-se por



					
						 funcionar como piso do estrato geográfico, onde são encontrados os recursos naturais.

						apresentar composição física homogênea e composição química heterogênea.

						possuir a mesma espessura tanto na porção terrestre quanto na oceânica.

						apresentar uma estruturação uniforme devido à formação geológica antiga.

						ser composta, na porção oceânica, por rochas predominantemente vulcânicas."
BioGeografia,"01. (UFRGS) Considere as afirmações abaixo, sobre os domínios morfoclimáticos propostos pelo geógrafo Aziz Ab’Saber, os quais resultam da interação de clima, relevo e vegetação e constituem paisagens próprias. 


					I - Domínio dos Mares de Morros: onde predomina o relevo mamelonares e a Mata Atlântica.

					II - Domínio das pradarias: onde predomina o clima subtropical, o relevo de coxilhas e a vegetação herbácea dos campos.

					III - Domínio das Caatingas: predominante no interior do nordeste brasileiro, caracterizado por depressões interplanálticas semiáridas. 

					 Quais estão corretas? 
					
						 Apenas I.


						 Apenas II.


						 Apenas I e III.


						 Apenas II e III.


						 I, II e III."
BioGeografia,"02. (UFPA) Sobre as paisagens naturais do mundo e a apropriação dos recursos naturais, é correto afirmar: 

					
						Os biomas tropicais, como a Amazônia no Brasil e a região do Congo na África, são caracterizados pelo clima equatorial quente úmido, solos pobres, vegetação latifoliada e hidrografia complexa. Nesses biomas coexistem atividades predatórias, como a pecuária extensiva e o extrativismo madeireiro, e atividades sustentáveis, como o extrativismo mineral e a pesca artesanal praticados pelas chamadas populações tradicionais. 
						 A savana representa um bioma subtropical caracterizado pela alternância de inverno seco e verão chuvoso, vegetação arbustiva e relevo com pequenas ondulações. Essas características têm facilitado a expansão da pecuária extensiva e o cultivo de grãos em alguns países africanos e em regiões como o cerrado brasileiro. O avanço da fronteira agropecuária sobre esse tipo de bioma tem intensificado o desmatamento, o empobrecimento do solo e o assoreamento dos rios.
						 As regiões desérticas são caracterizadas pelo clima árido com baixo índice de chuvas, solos pobres, vegetação xerófita e rios intermitentes. Algumas dessas regiões, a exemplo do Oriente Médio e Norte da África, antes desvalorizadas, estão sendo apropriadas em função das descobertas de enormes reservas de petróleo, expansão da agropecuária irrigada e indústria automobilística.
						 As regiões cobertas por florestas boreais, como a Taiga siberiana, situadas nas baixas latitudes do hemisfério norte, abrangem o Norte da Europa e da Rússia. Estão sendo exploradas pela indústria de papel e celulose e mais recentemente têm servido à exploração de petróleo.
						 As regiões temperadas estão situadas nas médias latitudes dos hemisférios norte e sul e são caracterizadas por baixas médias térmicas, estações de ano bem definidas e vegetação com pequena variedade de espécies. Essas regiões foram exploradas desde a primeira revolução industrial para a produção de carvão vegetal e mais tarde cederam espaço para campos de cultivo e áreas urbanas."
BioGeografia,"03. (FUVEST) Observe os mapas referentes à delimitação da bacia hidrográfica do rio Xingu, com o detalhamento da parte sul, onde fica o Parque Indígena do Xingu (PIX). 

					
					A bacia do Rio Xingu em Mato Grosso.
					 Com relação às áreas delimitadas nos mapas, está correto o que se afirma em:

					
						(A) Devido ao avanço do desmatamento nessa bacia hidrográfica nas últimas quatro décadas, processo iniciado pela atividade pecuária ao longo dos rios e seguido pelo avanço da monocultura de eucalipto, inviabilizam se quaisquer ações de recuperação e de conservação do bioma Amazônico.

						 O Parque Indígena do Xingu, criado principalmente para proteger diversas etnias indígenas, atua hoje como inibidor do avanço do desmatamento, função esperada para as diversas unidades de conservação previstas pelo Sistema Nacional de Unidades de Conservação.

						 Dentre as grandes bacias hidrográficas amazônicas, a bacia hidrográfica do rio Xingu, na disposição leste oeste, é uma das bacias da margem esquerda do rio Amazonas com importante conectividade entre dois biomas brasileiros: a Caatinga e o bioma Amazônico, ambos biológica e geologicamente diversos.

						 O desmatamento, observado no mapa, é resultado da monocultura de babaçu, praticada pelos indígenas que extraem seu óleo e vendem no para indústrias de cosméticos.

						 O avanço do desmatamento nessa área deve se às monoculturas de cana de açúcar e laranja, ambas cultivadas com variedades transgênicas adaptadas ao bioma Amazônico."
BioGeografia,"04. (UNICAMP) 

					

					 A figura anterior destaca um domínio natural marcado por especificidades físicas e de ocupação pela população. Assinale a alternativa que indica corretamente as características naturais e humanas predominantes nesse domínio. 
					 (Adaptado de Azis Ab´Saber, Os domínios de natureza no Brasil: potencialidades paisagísticas. São Paulo: Ateliêr Editorial, 2003, p. 159.)


					
						 Relevo de Mares de Morro; solos de tipo latossolos; grande concentração da população ao longo dos cursos d’água da região.
						
							Relevo de Altiplanos Basálticos; solos de tipo podzólicos; grande dispersão da população pelos diversos ecossistemas regionais.
						
							Relevo Residual de Colinas com afloramento rochoso; solos de tipo litólicos; grande dispersão da população pelo espaço regional.
						
							Relevo de Terras Baixas; solos de tipo gleissolos; grande concentração da população nas áreas inundáveis sazonalmente."
BioGeografia,"05. (UNESP) A Mata Atlântica desempenha uma extraordinária função social. Cobrindo parcela significativa do território brasileiro, a biodiversidade da Mata Atlântica fornece serviços ecológicos essenciais para cerca de 145 milhões de pessoas (70% da população brasileira) e constitui a base de recursos para uma parcela considerável do produto interno bruto do país.
					 (José M. C. Silva et al. “Conservação da Mata Atlântica brasileira”. In: Diogo C. Cabral e Ana G. Bustamante (orgs). Metamorfoses florestais, 2016. Adaptado.) 

					Considerando a função social destacada no excerto, são exemplos de serviços ecológicos prestados pela Mata Atlântica preservada: 
					
						a produção de oxigênio e a purificação do ar.
						 a seleção de espécies com valor econômico e a polinização das culturas.
						 a proteção contra a erosão e a recuperação de áreas agricultáveis.
						 a decomposição de rejeitos urbanos e o fornecimento de madeira.
						 a regulação do clima e o tratamento da água."
BioGeografia,"06. (UEFS) Sua biodiversidade é única em todo o mundo. Seus 844,4 mil quilômetros quadrados representam cerca de 10% do território brasileiro. Apesar do clima, é pontilhada por “ilhas de umidade”, de solo extremamente fértil. Vivem nesse bioma cerca de 1,2 mil espécies de plantas — 360 delas endêmicas (que não ocorrem em nenhum outro lugar do planeta) — e outras tantas de mamíferos, aves, répteis e anfíbios. Quanto à vegetação, as plantas são xerófilas, ou seja, adaptadas ao clima seco e à pouca quantidade de água. Algumas armazenam água; outras possuem raízes superficiais para captar o máximo das chuvas. Há as que contam com recursos para diminuir a transpiração, como espinhos e poucas folhas. A vegetação é formada por três estratos: o arbóreo, com árvores de 8 a 12 metros; o arbustivo, com vegetação de 2 a 5 metros; e o herbáceo, abaixo de 2 metros.
					
					Os maiores problemas enfrentados pela região são a salinização do solo e a desertificação de grandes áreas. (MAIS VIDA..., 2015. p. 81).
					
					MAIS VIDA, e mais temores. Geografia. Vestibular + Enem. São Paulo: Abril, ed. 7, 2015. 

					 O bioma brasileiro descrito no texto é o
					
					
						 do Cerrado.
						 do Pantanal.
						 da Amazônia.
						 da Caatinga.
						 da Mata Atlântica."
BioGeografia,"07. (FATEC) A Mata dos Cocais é um tipo de cobertura vegetal presente no MeioNorte do Brasil, principalmente nos estados do Maranhão e do Piauí. É uma zona de transição entre os biomas Floresta Amazônica, Cerrado e Caatinga.


					 Nessa área de transição são encontrados alguns tipos de vegetais, dentre os quais se destacam 
					
						 as seringueiras e as bananeiras.
						 as laranjeiras e os pinheiros.
						 as carnaúbas e os babaçus.
						 as catuabas e os juazeiros.
						 as perobas e os jatobás."
BioGeografia,"08. (UEMA) O conceito de seca é polêmico e vem sendo discutido pelos estudiosos há muito tempo. Ele pode ser considerado como uma prolongada falta de chuvas, que poderia se estender por dois ou três anos. Isso vale também ao que pode ser classificado como mês seco. A explicação gira em torno de três referenciais principais: quantidade de chuva (KÖPPEN, 1948); a relação entre a chuva e a temperatura (BAGNOULS, F.; GAUSSEN, H., 1957) e o balanço hídrico do solo (THORNTHWAITE,1948). Os autores apontam diferentes aspectos para classificar o período como seco. 
					CONTI, J. B. O conceito de desertificação (adaptado). Disponível em: www.ecodebate.com.br. Acesso: 02 set. 2011 

					Assinale a alternativa que identifica duas paisagens brasileiras adaptadas ao período seco em qualquer definição.
					
					
						 Floresta Amazônica e Caatinga.
						 Cerrado e Caatinga.
						 Pampa Gaúcho e Campo cerrado.
						 Caatinga e Mata de Araucária.
						 Mata Atlântica e Cerradão."
Cartografia,"01. (UFAM) Uma pessoa está numa cidade A, de longitude 30° leste, e faz um telefonema às 10 horas para seu amigo que mora na cidade B, situada a 30° oeste. A que horas a pessoa que mora na cidade B atendeu a ligação telefônica?

					
						 2 horas
						 6 horas
						 9 horas
						 16 horas
						 21 horas"
Cartografia,"02. (UEG) A escala se define como


					

						 a representação gráfica cujo denominador indica uma relação de igualdade com o numerador.
						 a relação entre as dimensões de um objeto ou lugar representado e sua medida real.
						 o processo utilizado para a representação da curvatura da terra num plano.
						 a distância entre os lugares, calculada em metros ou quilômetros.
						 o conjunto de símbolos que permitem a leitura do mapa."
Cartografia,"03. (UFPR) Sobre a projeção plana ou azimutal, assinale a alternativa correta. 

					
						Na referida projeção, a partir da seleção de um ponto de interesse, próximo do qual haverá as maiores distorções no mapa, o cartógrafo representa os demais locais de interesse. Com o distanciamento do ponto central, que tangencia a superfície de referência terrestre, as distorções são cada vez menores.
						Essa projeção, comumente utilizada para navegação, guarda ângulos de azimutes e seus meridianos passam pelo centro da projeção, sendo representados como retas.
						É uma projeção classificada como plano-polar quando tangencia médias latitudes.
						É uma projeção adequada para representar zonas de baixas latitudes e com poucas variações altimétricas, sendo evitada em regiões com altas latitudes.
						É uma projeção classificada como plano-oblíqua quando tangente à linha do Equador."
Cartografia,"04. (UCB) Na segunda-feira, Rafael voou de Brasília a Rio Branco, em um voo que dura 3h30, com decolagem às 21h e aterrissagem às 21h30, hora local.


					 Se o voo da volta está marcado para as
						15h, hora local, e não houver atraso,
						qual será o horário da chegada a
						Brasília?
					
						15h30.
						 21h30.
						 20h30.
						 18h30.
						 22h30."
Cartografia,"05. (PUC-RS) Os relógios de uma cidade localizada na América do Norte, a 80º Oeste e a 33º Norte, marcam 13 horas no horário de verão. Que horas marcariam se fossem acertados pelo Sol, hora verdadeira, desconsiderando o horário de verão?

					
						 11 horas e 20 minutos.
						 11 horas e 40 minutos.
						 12 horas e 40 minutos.
						 13 horas e 29 minutos.
						 14 horas."
Cartografia,"06. (PUC-PR) Observe as representações do continente africano, realizadas por meio das projeções de Mercator e de Peters. 

					

					 (Adaptado de Oswald Freyer - Eimbeke, p. 40)


					
						Assinale a alternativa CORRETA:
						 Na projeção de Peters, as distâncias entre os paralelos crescem à medida que se afastam do Equador, gerando um aumento exagerado das áreas localizadas próximas aos pólos.
						 A projeção de Mercator não se presta para a comparação de superfícies ou para medir distâncias, uma vez que foi criada para atender às necessidades de navegação do século XVI.
						 Tanto a projeção de Mercator como a de Peters falseiam a superfície dos continentes, seja pela deformação latitudinal (Mercator) ou pela deformação longitudinal (Peters).
						 Por situar a África no centro, a projeção de Peters torna a África maior do que de fato ela é, se comparada aos demais continentes.
						 Os mapas de Peters e de Mercator, por se tratarem de projeções cilíndricas, não causam nenhuma deformação na representação de qualquer região do globo terrestre em um plano."
Cartografia,"07. (UFES) As figuras a seguir mostram o mundo representado em projeções cartográficas diferentes. 
					

					
						Analisadas as figuras acima, é CORRETO afirmar que
						 ambas as projeções são cilíndricas, sendo que a de Mercator é equivalente e a de Peters é conforme.
						 a projeção de Mercator conserva as áreas dos continentes e, por esse motivo, é chamada de eurocêntrica.
						 a projeção de Mercator é conforme, ou seja, conserva as formas dos continentes e é a mais adequada para a navegação marítima.
						 a projeção de Peters é a mais adequada para a representação dos países do Terceiro Mundo, pois mantém as formas em proporção correta.
						 a projeção de Peters é equidistante, ou seja, mantém a proporcionalidade real nas medidas de distâncias e ângulos."
Cartografia,"08. (UFRN) As figuras a seguir foram construídas utilizando a projeção do tipo azimutal equidistante. 



					



					SENE, E. de; MOREIRA, J. C. ""Geografia geral e do Brasil: espaço geográfico e globalização"". São Paulo: Scipione, 2003. p. 446. 


					
						 Sobre esse tipo de projeção, podemos afirmar que
						 representa as áreas de latitudes médias e a conservação das formas e dos ângulos continentais.
						 mostra um mundo igual para as pessoas e as nações, apresentando, pois, um conteúdo político e social.
						 conserva as formas das massas e a proporcionalidade dos diversos continentes.
						 representa distâncias e direções exatas a partir de um centro, revelando, dessa forma, um conteúdo geopolítico."
