Tema,Pergunta
População: Etnia e Modernidade,"02. (UFF) A seleção alemã de futebol da Copa do Mundo de 2010 apresentou cinco atletas nascidos fora da Alemanha e seis filhos de imigrantes, num total de 23 jogadores. “É a verdadeira nação arco-íris”, estampou um jornal de Johannesburgo, brincando com a expressão utilizada pelo bispo Desmond Tutu para designar a África do Sul pós-apartheid. Para o sociólogo alemão Martin Curi, a inserção de estrangeiros, principalmente de turcos, na equipe alemã ocorre até com certo atraso. Mesut Ozil e Sedar Tasci são os primeiros turcos a jogarem uma Copa do Mundo pelo país, 40 anos após ser registrado o maior fluxo migratório da Turquia para a Alemanha. 
					Folha de São Paulo, 03/07/2010, p. D-28. Adaptação 

					


					Com relação à inserção de jogadores estrangeiros destacada no texto, conclui-se, adequadamente, que ela 
					
						 representa a flexibilização do mercado de trabalho na União Europeia.

						 mostra a inexistência da xenofobia por parte da população nativa original.

						 dificulta os fluxos migratórios para o país mais desenvolvido da Europa.

						 expressa o caráter pluriétnico da sociedade alemã contemporânea.

						 reflete a falta de programas sociais para a juventude alemã desportiva."
População: Etnia e Modernidade,"03.(UFF) EM 5 ANOS, NOVA ORLEANS RENASCE BRANCA 


					“A tragédia do furacão Katrina em Nova Orleans completa cinco anos neste mês com um legado que vai muito além das casas ainda destruídas da cidade: o equilíbrio de poder foi totalmente realinhado, a clivagem racial, aprofundada. A maioria negra, que sofreu retirada forçada durante a enchente ocorrida após o furacão, viu sua dominância sobre a política das últimas décadas ir se esvaindo até que praticamente todos os órgãos eletivos locais “embranqueceram”. (...) Moradores e estudiosos afirmam que a virada é resultado de um esforço deliberado. O primeiro plano de reconstrução da cidade previa fazer parques nos bairros negros devastados. Pra onde os antigos moradores voltariam? De referência, para lugar nenhum.” 
					Folha de São Paulo, 08/08/2010, p. A24 

					 Para além dos efeitos imediatos do furacão Katrina, a reportagem focaliza a dinâmica de “embranquecimento” de Nova Orleans, diretamente associada a processos de

					
						 nomadismo urbano.

						 densificação urbana.

						 segregação espacial.

						 exploração demográfica.

						 migração sazonal."
População: Etnia e Modernidade,"04. (UEG) Um dos grandes desafios do século XXI para tornar o mundo melhor é o de aprender a conviver com os outros, aceitar e respeitar os que são diferentes na cultura, na religião, nos costumes, na sexualidade etc. A intolerância, os preconceitos, as discriminações e o racismo, no entanto, vêm crescendo. Sobre esse assunto, é CORRETO afirmar: 

					
						 o princípio de que todos os seres humanos são iguais, independentemente de sexo, cor da pele, orientação sexual, local de nascimento, valores culturais, existe de direito e de fato nas sociedades democráticas.

						 o racismo consiste numa tendência a desvalorizar certos grupos étnicos, sociais ou culturais, atribuindo-lhes características inferiores e manifesta-se na segregação e rejeição de valores culturais.

						 os neonazistas, os carecas, os arianos, entre outros, são grupos organizados que visam combater os preconceitos, sobretudo contra migrantes pobres.

						 a xenofobia e a homofobia atingem em maior grau os indígenas, os negros e a mulher, considerados inferiores em determinadas sociedades."
População: Etnia e Modernidade,"05. (UERJ) Cada um, de cada lugar do mundo, tem de assinalar em seu endereço eletrônico o país onde mora e de onde fala (.br, .ar, .mx, etc.); aquele que fala a partir dos EUA não precisa apor .us ao seu endereço e, assim, é como se falasse de lugar-nenhum, tornando familiar que cada qual se veja, sempre, de um lugar determinado, enquanto haveria aqueles que falam como se fossem do mundo e não de nenhuma parte específica. 
					Adaptado de Carlos Walter Porto-Gonçalves In: LANDER, Edgardo (org.). A colonialidade do saber. Buenos Aires: CLACSO, 2005. 

					 O texto acima contém uma reflexão acerca de um aspecto importante das redes mundiais de produção e circulação de conhecimento. Segundo o autor, essas redes são marcadas pelo conceito de:
					
						 pluralismo

						 autoritarismo

						 nacionalismo

						 etnocentrismo"
População: Etnia e Modernidade,"06. (MACKENZIE) Sobre a criação da reserva indicada no mapa, é correto afirmar que 

					

					
						 se trata da reserva “Raposa Serra do Sol”, cuja criação é apoiada pelos índios e criticada por fazendeiros que querem a descontinuidade da reserva.

						 se trata da reserva de Dourados, cuja a criação irá prejudicar não só os agricultores de soja, como os índios da região, que vivem da criação de gado.

						 se trata da reserva de Dourados, que beneficiará os índios de uma forma geral, mas dificultará o escoamento da produção de arroz, banana e milho.

						 representa uma área equivalente à Bélgica, chamada de Parque Indígena do Xingu com uma população inferior a cinco mil índios.

						 corresponde a reserva “Raposa Serra do Sol”, onde o Governo Federal, ONGs e ambientalistas defendem a sua efetivação e lutam para manter nela, três cidades e grandes lavouras de arroz."
População: Etnia e Modernidade,"07. (UFF) “Choque de civilizações” é o título do livro de autoria do cientista norte-americano Samuel Huntington, no qual são identificados conjuntos civilizacionais e seus possíveis enfrentamentos, conforme ilustrado no mapa abaixo: 

					

					Fonte: BONIFACE, Pascal e VÉDRINE, Hubert. Atlas do Mundo Global. São Paulo: Estação Liberdade, 2009. 

					 A partir da análise do mapa, outro título adequado às ideias de Samuel Huntington é: 
					
						 “O mundo Ocidental em risco”

						 “A ascensão dos nacionalismos periféricos”

						 “O triunfo global do mundo africano”

						 “O fim da história e da ideologia”

						 “O declínio das religiões imperiais”"
População: Etnia e Modernidade,"08. (UERJ) Um dos grandes desafios do século XXI para tornar o mundo melhor é o de aprender a conviver com os outros, aceitar e respeitar os que são diferentes na cultura, na religião, nos costumes, na sexualidade etc. A intolerância, os preconceitos, as discriminações e o racismo, no entanto, vêm crescendo. Sobre esse assunto, é CORRETO afirmar: 

					
						o princípio de que todos os seres humanos são iguais, independentemente de sexo, cor da pele, orientação sexual, local de nascimento, valores culturais, existe de direito e de fato nas sociedades democráticas.

						 o racismo consiste numa tendência a desvalorizar certos grupos étnicos, sociais ou culturais, atribuindo-lhes características inferiores e manifesta-se na segregação e rejeição de valores culturais.

						 os neonazistas, os carecas, os arianos, entre outros, são grupos organizados que visam combater os preconceitos, sobretudo contra migrantes pobres.

						 a xenofobia e a homofobia atingem em maior grau os indígenas, os negros e a mulher, considerados inferiores em determinadas sociedades."
População: Etnia e Modernidade,"09. (UFJF) Leia a informação a seguir, veiculada pelo jornal Correio do Brasil.



					30/7/2008 20:51:30

					Roma se começa a conhecer pelo Gueto

					Por Flavio Vitari - de Roma



					Apesar de ser o centro do mundo cristão, vamos começar pelo Gueto. Isso mesmo, pelo Gueto. Por mais extraordinário que pareça, os judeus estão em Roma desde o século II a.C., é a comunidade mais antiga da Europa. Por volta do séc XVI, papado de Paulo IV, começaram a ser perseguidos, tendo início a construção das muralhas que isolariam a área por eles habitadas, que no fascismo ficou conhecido como Gueto judaico. 

					Disponível em < http://www.correiodobrasil.com.br/coluna.asp?c=141563 >. Acesso em 01/11/2008.

					 Com a globalização, à medida que aumenta a mobilidade humana, aumentam os muros e as divisões visíveis e invisíveis, aumentam os guetos. O gueto é
					
						 uma área definida como o espaço físico sobre o qual o Estado exerce seu poder soberano.

						 um estado não-independente e subordinado, até certo grau, a um poder externo ou estrangeiro.

						 um bairro de uma cidade, onde vivem os membros de uma etnia ou outro grupo minoritário.

						 um território nacional autônomo totalmente cercado por um território estrangeiro.

						 uma região geográfica que forma uma unidade distinta em virtude de determinadas características."
População: Etnia e Modernidade,"10. (UFG) Leia o trecho do artigo de Demétrio Magnoli.

					 As etnias hutus e tutsis foram inventadas pelo poder colonial europeu, que encontrou uma sociedade organizada em torno de um rei de caráter sagrado, cuja autoridade se baseava numa aristocracia de proprietários de rebanhos (os tutsis) que subordinava a massa de camponeses (os hutus). Toda sociedade ligava-se por laços de dependência pessoal, que asseguravam certa coesão. Tudo começou com o censo, que registrou as duas “etnias”. Em 1926, o governo colonial emitiu documentos de identidade com rótulos “tutsi” e “hutu”. Manuais vulgares repetem, até hoje, narrativas históricas que opõem as etnias, usando, para tanto, razões científicas. 
					MAGNOLI, D. O país das cotas e do genocídio. Folha de S. Paulo, 19 ago. 2005. Ilustrada. [Adaptado]. 

					 utor discute a relação entre os dois grupos envolvidos no conflito ocorrido em 1994, em Ruanda. Sobre a emergência desse conflito contemporâneo, pode-se afirmar que
					
						 o desacordo era anterior ao colonialismo, pois historicamente tutsis e hutus disputavam a posse da terra.

						 a distinção entre tutsis e hutus reforçou a oposição ao domínio colonial europeu.

						 o discurso histórico desqualificou a sacralidade da figura real, induzindo os grupos à rivalidade.

						 a exploração dos proprietários de rebanhos sobre os camponeses definia as relações étnicas.

						 as identificações étnicas, patrocinadas por ação governamental, fermentaram o conflito e o massacre."
População: Etnia e Modernidade,"11. (UEL) Analise a charge e o texto a seguir. 

					

					“A pressão de grupos políticos e empresariais de Rondônia que defendem a liberação do garimpo a todo o custo, principalmente pelo próprio governo do Estado que se propõe a comprar os diamantes via Companhia Rondoniense de Mineração – CMR, tem funcionado como incentivador aos garimpeiros no processo de invasão em busca de diamantes”.


					 (SANTOS, R. A. Índios e diamantes em Rondônia. Disponível em: <www.socioambiental /noticias.com.br>. Acesso em: 11 Jun. 2005.)



					Com base na charge, no texto e nos conhecimentos sobre o tema, considere as afirmativas a seguir.


					I. A charge e o texto mostram a preocupação do Governo brasileiro em desenvolver uma Política Indigenista que vise garantir os direitos territoriais dos povos indígenas.

						II. O texto e a charge remetem à importância da política indigenista brasileira nos últimos cinco anos e aos ganhos sociais decorrentes da garantia dos direitos a essa população.

						III. A partir da charge e do texto, é possível verificar que os povos indígenas estão alijados do apoio oficial necessário à luta pela manutenção de suas terras e de seus recursos naturais.

						IV. A charge e o texto indicam que, em diversas instâncias, ecoam ações e discursos contrários às reais necessidades dos povos indígenas.
					
						I e II.

						 II e III.

						 III e IV.

						 I, II e IV.

						 I, III e IV."
População: Etnia e Modernidade,"12. (UEPB) Com o fim da escravidão no Brasil, em 1888, a situação do negro sofreu bastante modificação. Mas, teria o negro passado a desfrutar as mesmas condições econômicas e sociais que os brancos desfrutam? Tudo parece indicar que não. O negro continua a ocupar um lugar inferior na hierarquia social, ganhando salários menores e vivendo em piores condições que a média da população. 

					Com base no texto acima, é correto afirmar: 

					I. O sistema de cotas para negros nas universidades, criado pelo Governo Federal, tem o objetivo de facilitar o acesso de negros de baixa renda ao ensino superior de qualidade.

						II. Não existe diferença na hierarquia social entre negros e brancos, pois ambos recebem os mesmos salários.

						III. Segundo o Governo Federal não existe necessidade da criação de cotas, pois os negros possuem as mesmas condições e oportunidades dos demais segmentos da sociedade que almejam ingressar nas Universidades Públicas e Particulares.

						IV. O sistema de cotas abre caminhos para que pessoas comuns tenham uma educação digna e de qualidade, independente de sua cor, de acordo apenas com sua capacidade intelectual. 

					Está(ão) correta(s), apenas a(s) proposição(ões) 
					
						 II, III e IV

						 I, II e III

						 I

						 IV

						 III"
População: Etnia e Modernidade,"13. (FUVEST) ""Hoje, a civilização só parece progredir onde existe um clima estimulante. Uma civilização de primeira categoria pode ser transportada de um lugar para outro mas só pode crescer com vigor onde o clima der energia aos homens.""

					 (Huntington, 1915)

					Na atualidade, considerando as linhas de pensamento geográfico mais modernas, a afirmação contida no texto pode ser

					
						 confirmada em numerosas áreas de colonização européia da África que não conseguiram se desenvolver em virtude dos climas áridos e semi-áridos.

						 contestada em sua essência, pois não são exclusivamente as condições naturais que justificam o grau de desenvolvimento de uma região.

						 confirmada em sua essência, pois em várias áreas da África e da América Latina as condições climáticas adversas retardaram o progresso.

						 contestada, pois não é o clima, mas o meio natural como um todo, o principal fator responsável pelo fraco desenvolvimento econômico de várias partes do mundo, a exemplo do Sahael africano.

						 confirmada na Ásia das Monções, onde a forte concentração de chuvas num só período do ano impediu que as influências da colonização européia promovessem o desenvolvimento da região."
População: Etnia e Modernidade,"14. (UFSM) Sobre o contingente da população indígena brasileira a partir do século XX, pode-se afirmar que 

					I - se verifica uma tendência de aumento desse contingente, principalmente em função da delimitação de reservas indígenas.

						II - essa população, hoje muito reduzida (menos de 0,25%), está concentrada, principalmente, nas regiões Norte e Centro-Oeste.

						III - a superfície total das terras indígenas equivale a um percentual pouco significativo da área do Brasil.

						IV - ocorre um etnocídio no modo de vida, hábitos, crenças, língua, tecnologia e costumes. 
					Estão corretas
					
						 apenas I e II.

						 apenas II e III.

						 apenas I e IV.

						 apenas III e IV.

						 I, II, III e IV."
População: Etnia e Modernidade,"15. (UFC) Em tempos neoliberias, o processo de globalização, que interliga lugares, através da movimentação de pessoas, de valores, de capitais e de mercadorias, pode ocasionar situações que expõem a humanidade a condições de risco. Entre as mais graves e/ou sobre as tentativas de evitá-las, é possível destacar, de modo corre 

					
						 a difusão de preconceitos contra estrangeiros, pela crença de que as pessoas e os produtos vindos de fora são os responsáveis pelas crises da economia e pelo desemprego.

						 a transferência de doenças degenerativas pelos continentes, como as neoplasias, as doenças cardíacas, o Mal de Alzeimer, entre outras, até há poucos anos, típicas de países desenvolvidos.

						 a repercussão das crises, nas bolsas de valores, provocadas por conflitos armados, que têm efeitos semelhantes entre países ricos e pobres e entre pessoas de diferentes condições sociais.

						 a carência de água, provocada pelo seu consumo inadequado, que levou o mundo a adotar como forma de controle a racionalização e a privatização do seu uso.

						 o desequilíbrio na distribuição da população mundial, solucionável através da transferência de populações, possibilidade assegurada pelas políticas migratórias internacionais."
Urbanização,"01. (UEMA) Leia o texto e analise a imagem para responder à questão. 
					O mapa apresenta a área de abrangência da futura megalópole e algumas das cidades afetadas por esse processo. 

					

					 Às vezes não é mais possível saber onde é a divisa entre duas cidades, porque elas se desenvolvem tão juntas que acabam parecendo uma só. Isso acontece porque a população vai crescendo e os espaços vazios vão sendo ocupados. [...] Porém ela pode causar problemas, como quando uma construção começa em uma cidade e termina em outra.

					Esse fenômeno no Brasil é tão intenso que tende a consolidar, até o ano 2050, uma megalópole entre duas capitais metropolitanas brasileiras.



					 O fenômeno e as cidades a que o texto se refere são, respectivamente, denominados 
					
						 Fragmentação; São Paulo e Belo Horizonte


						Conurbação; São Paulo e Rio de Janeiro.


						Megalopolização; Campinas e São Paulo


						Metropolização; Campinas e Rio de Janeiro.


						Periferização; Belo Horizonte e Rio de Janeiro."
Urbanização,"02. (UECE) Atente ao seguinte excerto: “O tratamento do clima urbano, como um dos componentes da qualidade do ambiente, não poderá ser considerado insignificante para o mundo moderno. Com isso, há um envolvimento, se não metafísico, pelo menos, ideológico no seu sentido mais puro. Ele se reveste de um anseio, uma expectativa em participar das cruzadas pró-ambiente, às quais se filiam muitos idealistas ou ecoativistas, como às vezes são designados aqueles que almejam melhor qualidade de vida para a sociedade”. 

					Monteiro, Carlos Augusto de Figueiredo Teoria e Clima Urbano, um projeto e seus caminhos Clima Urbano. Ed Contexto. São Paulo. 2009. p.14. 

					Considerando o excerto, a partir da concepção do autor, pode-se concluir acertadamente que 
					
						 o estudo do clima urbano não é uma tarefa simples ou sem importância. Pelo contrário, é por demais relevante para a qualidade ambiental nos grandes centros urbanos e no planeta como um todo.


						o estudo do clima urbano interessa apenas aos habitantes das grandes metrópoles e a uma minoria de pesquisadores e ambientalistas.

						apenas as condições físicas e ambientais das grandes cidades, como as principais
						características do seu relevo e da sua geologia, influenciam no clima urbano.


						muito embora a temática do clima urbano seja importante para o melhor entendimento da relação homem x natureza nas cidades, ainda são insignificantes os estudos nessa área."
Urbanização,"03. (FGV-SP) As opções a seguir apresentam transformações recentes do espaço urbano de São Paulo, à exceção de uma. Assinale-a. 

					
						 Com a implantação do plano de avenidas, o “centro” se consolida como área verticalizada, em que a função residencial voltada para as classes de baixa renda passa a ser prioritária.


						A “verticalização” da Avenida Paulista atraiu empresas e o sistema financeiro, movimento que segue no eixo sudoeste, com a construção de edifícios nas áreas próximas à Marginal Pinheiros, conformando uma nova área de expansão corporativa.


						A violência afeta a convivência urbana, o que provoca o enclausuramento das classes média e alta em condomínios fechados e shopping centers, com o abandono do espaço das ruas ou sua privatização por meio de vigilância ostensiva.


						Os bairros populares se instalam nas áreas periféricas, como resultado de um crescimento metropolitano não planejado, em que a valorização do solo urbano tende a expulsar as populações de menor renda.


						A cidade no século XXI apresenta-se como o principal polo de conexão da economia brasileira com o resto do mundo, mas esse afluxo financeiro não permitiu reverter as tendências de exclusão e de segmentação social."
Urbanização,"04. (USP) O processo de industrialização que se efetivou em São Paulo a partir do início do século XX foi o indutor do processo de metropolização. A partir do final dos anos 1950, a concentração da estrutura produtiva e a centralização do capital em São Paulo foram acompanhadas de uma urbanização contraditória que, ao mesmo tempo, absorvia as modernidades possíveis e expulsava para as periferias imensa quantidade de pessoas que, na impossibilidade de viver o urbano, contraditoriamente, potencializavam a sua expansão. Assim, de 1960 a 1980, a expansão da metrópole caracterizou-se também pela intensa expansão de sua área construída, marcadamente fragmentada e hierarquizada. Esse processo se constituiu em um ciclo da expansão capitalista em São Paulo marcada por sua periferização. Isabel Alvarez. Projetos Urbanos: alianças e conflitos na reprodução da metrópole. 
					Disponível em: http://gesp.fflch.usp.br/sites/gesp.fflch.usp.br/files/02611.pdf. Acessado em 10/08/2015. Adaptado. 

					Com base no texto e em seus conhecimentos, é correto afirmar 
					
						 O processo que levou à formação da metrópole paulistana foi dual, pois, ao trazer modernidade, trouxe também segregação social


						A cidade de São Paulo, no período entre o final da Segunda Guerra Mundial e os anos de 1980, conheceu um processo intenso de desconcentração industrial


						A periferia de São Paulo continua tendo, nos dias de hoje, um papel fundamental de eliminar a fragmentação e a hierarquização espacial


						A periferização, em São Paulo, cresceu com ritmo acelerado até os anos de 1980, e, a partir daí, estagnou, devido à retração de investimentos na metrópole


						A expansão da área construída da metrópole, na década de 1960, permitiu, ao mesmo tempo, ampliar a mancha urbana e eliminar a fragmentação espacial"
Urbanização,"05. (FGV-RJ) A mobilidade urbana envolve aspectos socioeconômicos relativos ao modo de vida nas cidades: o acesso aos meios de transporte para o trajeto casa-trabalho e aos serviços de saúde, educação, cultura e lazer. Na Região Metropolitana do Rio de Janeiro (RMRJ), a questão da mobilidade urbana é agravada pela forma de ocupação e organização do espaço. 


					


					Sobre o problema da mobilidade urbana na RMRJ, com base no mapa, NÃO é correto afirmar: 
					
						A distribuição espacial dos equipamentos de saúde e de educação não atende às necessidades da população residente nos municípios periféricos, o que a obriga a grandes deslocamentos para obtê-los.


						A concentração dos postos de trabalho nas áreas centrais exige que a população das regiões periféricas realize longos trajetos, que demandam tempo e parte significativa de sua renda.


						O deslocamento das atividades produtivas para as áreas periféricas provoca o adensamento da mancha urbana, o que modifica o sentido dos fluxos de circulação intraurbanos.


						O uso excessivo do transporte sobre rodas compromete a qualidade do ar, o que, somado ao estresse e ao ruído, atinge a saúde e a qualidade de vida da população.


						O tempo gasto nos chamados movimentos pendulares deixa de ser convertido em aumento da produtividade, assim como os recursos consumidos no custo das passagens deixam de impulsionar o consumo."
Urbanização,"06. (UEA) Observe o mapa, que aborda o processo de crescimento horizontal que une alguns municípios. 

					


					Assinale a alternativa que apresenta, correta e respectivamente, o nome desse processo e a sua denominação segundo a legislação brasileira. 
					
						 Processo de transição e Região Integrada de Desenvolvimento.


						Processo de flexibilização e Perímetro Urbano.


						Processo de terceirização e Metrópole.


						Processo de segregação e Megalópole.


						Processo de conurbação e Região Metropolitana."
Urbanização,"07. (UEA) Que a capital do Amazonas é uma cidade quente, moradores e visitantes de Manaus já constataram. Nem todos, no entanto, sabem explicar o motivo de tanta “quentura”. Moradores mais antigos afirmam que a temperatura vem aumentando nos últimos anos. Nos bairros Chapada, Dom Pedro e Alvorada a temperatura chega a ficar até 8 graus acima das demais, segundo estudo. 
					(http://d.emtempo.com.br. Adaptado.) 

					 O fenômeno que explica a “quentura” de Manaus é
					
						 a ilha de calor, provocada pelo aumento da urbanização.


						o buraco na camada de ozônio, motivado pelas emissões de poluentes industriais.


						a maritimidade térmica, provocada pelo afastamento da cidade do mar.


						o intemperismo, responsável pelo desequilíbrio da interface litosfera-atmosfera.


						o relevo, relacionado à forte ação dos ventos."
